{  "plan_version": "1.0",  "created_at": "2026-04-20",  "planning_mode": "standard",  "proposal_path": "C:\\Users\\vguigon\\Desktop\\Research_directory\\Experiments\\AI-research-feedback\\tests\\fixtures\\google_org\\Google Impact Challenge_ AI for Science application.pdf",  "supporting_files": [],  "effective_target_program": "foundation",  "grant_profile_path": "C:\\Users\\vguigon\\Desktop\\Research_directory\\Experiments\\AI-research-feedback\\review\\grants\\google-impact-challenge-ai-for-science-application\\profile.json",  "expert_registry_path": "C:\\Users\\vguigon\\Desktop\\Research_directory\\Experiments\\AI-research-feedback\\templates\\grants\\expert-registry.json",  "proposal_summary": "CompPhen proposes an AI-enabled computational phenotyping framework for discovery and validation across behavioral tasks, with UMD leading method development and McGill contributing clinical extension and translational validation. The application emphasizes precision psychiatry, open-science outputs such as datasets, tools, models, and publications, and a pathway from technical advances to broader public benefit in health and life sciences.",  "panel_selection": [    {      "lens_id": "clarity-compliance",      "label": "Clarity, writing, and compliance",      "status": "selected",      "rationale": "Selected because the proposal is a form-style Google.org application with many short fields, explicit outcome and budget prompts, and a mixed panel that will reward clear reviewer cues and compliance with required sections.",      "priority": "primary",      "core_questions": [        "Is the proposal easy for a mixed review panel to read quickly?",        "Are required components and reviewer cues visible?",        "Does the language mirror the call without sounding generic?"      ]    },    {      "lens_id": "significance-fit",      "label": "Significance, innovation, and funder fit",      "status": "selected",      "rationale": "Selected because the proposal must persuade Google.org that CompPhen addresses a critical unresolved AI-for-science problem in precision psychiatry and fits the call's emphasis on scientific ambition, public goods, and broad downstream impact.",      "priority": "primary",      "core_questions": [        "Why should this funder support this project now?",        "Is the problem important to the stated audience?",        "Are novelty and differentiation framed credibly?"      ]    },    {      "lens_id": "methods-feasibility",      "label": "Methods and feasibility",      "status": "selected",      "rationale": "Selected because the core claim depends on multi-task hierarchical modeling, reliability-aware benchmarking, and clinical translation, so methodological credibility and execution risk are central to review.",      "priority": "primary",      "core_questions": [        "Can the stated aims be executed with the proposed methods and resources?",        "Are major dependencies, risks, and fallback plans visible?",        "Are success metrics measurable and credible?"      ]    },    {      "lens_id": "budget-team-operations",      "label": "Budget, team, and management",      "status": "selected",      "rationale": "Selected because the application includes budget categories, a timeline, cross-institution coordination between UMD and McGill, and explicit execution and resourcing expectations from the funder.",      "priority": "primary",      "core_questions": [        "Do staffing, budget, and timeline match the work?",        "Are coordination and governance responsibilities clear?",        "Are required support documents complete?"      ]    },    {      "lens_id": "philanthropy-public-impact",      "label": "Philanthropy and public impact",      "status": "selected",      "rationale": "Selected because the profile and proposal both stress public benefit, theory of change, open-science outputs, and communication to philanthropy-oriented and implementation-minded reviewers beyond a purely technical panel.",      "priority": "primary",      "core_questions": [        "Is the social value proposition explicit and plausible?",        "Does the proposal show a credible pathway from outputs to public benefit?",        "Will non-technical reviewers understand why the work matters?"      ],      "organization_overlay_ids": [        "centre-for-public-impact",        "google-org-public-benefit"      ]    },    {      "lens_id": "ethics-philosophy",      "label": "Ethics and philosophy",      "status": "selected",      "rationale": "Selected because Google.org explicitly evaluates responsible AI and openness, and the proposal makes governance-adjacent claims about reliability, downstream use, and scientific legitimacy that benefit from a dedicated ethics and responsible-AI check.",      "priority": "secondary",      "core_questions": [        "What assumptions about benefit, fairness, and legitimacy does the proposal make?",        "Are normative tradeoffs explicit rather than hidden?",        "Would a skeptical ethics reviewer find the governance story adequate?"      ],      "organization_overlay_ids": [        "google-org-responsible-ai"      ]    }  ],  "uncertainties": [    "The cached profile flags manual review because official sources conflict on the application deadline, so the final submission timing should be confirmed before review execution.",    "The reviewer ecosystem is mixed and partly inferred from partner organizations and profile notes, so exact weighting between technical, philanthropy, and governance lenses remains uncertain.",    "No neighboring supporting files were present next to the proposal PDF even though the application text references a budget workbook and timeline-style milestones."  ],  "confirmation": {    "required": true,    "reason": "Confirmation is required because the profile requires manual review and the proposal targets a mixed technical, public-impact, and organization-overlay panel."  }}